{
  "$comment": "GENERATED by bun nv render — do not edit",
  "$schema": "https://json-schema.org/draft/2020-12/schema",
  "title": "gap",
  "type": "object",
  "properties": {
    "module": {
      "type": "string"
    },
    "title": {
      "type": "string"
    },
    "text": {
      "type": "string"
    },
    "goal": {
      "type": "string",
      "pattern": "^[a-z0-9][a-z0-9-]*$"
    },
    "milestone": {
      "type": "string",
      "minLength": 1,
      "x-references": "milestone"
    }
  },
  "required": [
    "module",
    "title",
    "text"
  ],
  "additionalProperties": false
}
